{
  "template_id": "b7e6b1a0-1c3d-4f2a-9e3a-1234567890ad",
  "partner_id": "click_uz",
  "operator_id": null,
  "sender_id": "CLICK",
  "channel": "SMS",
  "category": "TRANSACTION",
  "pattern": "%w shartnoma bo'yicha %d{1,6} so'm to'lovni bugun amalga oshiring",
  "version": 1,
  "status": "active"
}
